{
 "format_version": "1",
 "source_digest": "<digest>",
 "title": "テストと CI の小さな直しを重ねた週",
 "tasks": [
  {
   "id": "T1",
   "work_item": "1287",
   "title": "Work Item #1287 を Resolved にする",
   "one_liner": "送る内容を見せて承認を待っている。まだ送っていない",
   "state": "できていない",
   "points": [
    "State を Resolved にして、コメントに PR #482 を書く",
    "DryRun で送る内容を確かめた",
    "承認を待っている"
   ],
   "sessions": [
    "10000000-0000-4000-8000-000000000005"
   ],
   "deliverables": [],
   "refs": [
    "10000000-0000-4000-8000-000000000005:R1",
    "10000000-0000-4000-8000-000000000005:I1"
   ],
   "failures": [],
   "lessons": []
  },
  {
   "id": "T2",
   "work_item": null,
   "title": "CI でだけ落ちる test_retry",
   "one_liner": "タイムアウトを環境変数で変えられるようにした。CI ではまだ確かめていない",
   "state": "一部",
   "points": [
    "原因は 2 秒のタイムアウト",
    "環境変数 RETRY_TIMEOUT で変えられるようにし、既定を 10 秒にした",
    "CI での確認が残っている"
   ],
   "sessions": [
    "10000000-0000-4000-8000-000000000004"
   ],
   "deliverables": [],
   "refs": [
    "10000000-0000-4000-8000-000000000004:D1",
    "10000000-0000-4000-8000-000000000004:I1"
   ],
   "failures": [
    "test_retry が手元で落ちた → タイムアウトを延ばして通った"
   ],
   "lessons": [
    "CI でだけ落ちるテストは、まずタイムアウトを疑う"
   ]
  },
  {
   "id": "T3",
   "work_item": null,
   "title": "失敗したテストを抜き出すスクリプト",
   "one_liner": "JUnit XML から失敗したテストの名前を JSON で出すスクリプトを書いた",
   "state": "できた",
   "points": [
    "途中で出力を JSON に変えた",
    "Markdown の表は取り下げた"
   ],
   "sessions": [
    "10000000-0000-4000-8000-000000000003"
   ],
   "deliverables": [],
   "refs": [
    "10000000-0000-4000-8000-000000000003:R1",
    "10000000-0000-4000-8000-000000000003:D1"
   ],
   "failures": [],
   "lessons": []
  },
  {
   "id": "T4",
   "work_item": null,
   "title": "pytest の警告を消す",
   "one_liner": "datetime.utcnow() の置き換えで警告 3 件を消した",
   "state": "できた",
   "points": [
    "テストは変えていない"
   ],
   "sessions": [
    "10000000-0000-4000-8000-000000000001"
   ],
   "deliverables": [],
   "refs": [
    "10000000-0000-4000-8000-000000000001:D1"
   ],
   "failures": [],
   "lessons": []
  },
  {
   "id": "T5",
   "work_item": null,
   "title": "パイプラインの YAML の書き方の確認",
   "one_liner": "ステージ・ジョブ・キャッシュの書き方を 45 の質問で確かめた",
   "state": "できた",
   "points": [
    "ステージ・ジョブ・キャッシュの順に確かめた"
   ],
   "sessions": [
    "10000000-0000-4000-8000-000000000002"
   ],
   "deliverables": [],
   "refs": [
    "10000000-0000-4000-8000-000000000002:Q1"
   ],
   "failures": [],
   "lessons": []
  },
  {
   "id": "T6",
   "work_item": null,
   "title": "YAML を templates に分ける",
   "one_liner": "ファイルを読んだところで中断した",
   "state": "未確認",
   "points": [
    "中断したので作業は始まっていない"
   ],
   "sessions": [
    "10000000-0000-4000-8000-000000000006"
   ],
   "deliverables": [],
   "refs": [
    "10000000-0000-4000-8000-000000000006:I1"
   ],
   "failures": [],
   "lessons": []
  }
 ],
 "lessons": [
  "CI でだけ落ちるテストは、まずタイムアウトを疑う"
 ],
 "troubles": [
  "Work Item の更新が承認待ちで止まっている"
 ],
 "carry_over": [
  {
   "kind": "判断待ち",
   "task": "T1",
   "text": "Work Item #1287 の更新を送ってよいかの承認",
   "ref": "10000000-0000-4000-8000-000000000005:I1"
  },
  {
   "kind": "次に",
   "task": "T2",
   "text": "CI で test_retry を流して確かめる",
   "ref": "10000000-0000-4000-8000-000000000004:I1"
  },
  {
   "kind": "未解決",
   "task": "T6",
   "text": "YAML を templates に分ける作業",
   "ref": "10000000-0000-4000-8000-000000000006:I1"
  }
 ],
 "demo_order": [
  "T3",
  "T4"
 ]
}
